{
  "schema_version": 1,
  "review_type": "PLAN",
  "task_id": "drawbeams-fix-corridor",
  "module_id": "antigravity.drawbeams",
  "review_run_id": "plan-review-run-001",
  "reviewer": "codex",
  "decision": "APPROVED",
  "reviewed_branch": "task/drawbeams-fix-corridor",
  "base_commit": "68b008c476f949b166f2e26ac68010cb2b3259bf",
  "task_sha256": "ca247d8f188f899a6c0bf1f64f649bc100900697987ad086a7ee1052e6274fa6",
  "scope_sha256": "0d2689bbd90fa4b0c50977cb5478b578bd288ffe719ab012c704902ed65a5cd3",
  "plan_sha256": "4a838cd929b0f927edb3b9af9a2f86c6d303af0189c1c74a2c1b8c2cc7f3fb83",
  "reviewed_at": "2026-08-01T02:00:00Z",
  "findings": []
}
